
 /----------------------------------------------------------------------------\
 |  yosys -- Yosys Open SYnthesis Suite                                       |
 |  Copyright (C) 2012 - 2025  Claire Xenia Wolf <claire@yosyshq.com>         |
 |  Distributed under an ISC-like license, type "license" to see terms        |
 \----------------------------------------------------------------------------/
 Yosys 0.53 (git sha1 53c22ab7c, g++ 13.3.0-6ubuntu2~24.04 -fPIC -O3)

1. Executing Liberty frontend: /foss/pdks/sky130A/libs.ref/sky130_fd_sc_hd/lib/sky130_fd_sc_hd__tt_025C_1v80.lib
Imported 428 cell types from liberty file.
[INFO] Using SDC file '/foss/designs/ALU/runs/RUN_2025-06-08_18-02-53/06-yosys-synthesis/synthesis.abc.sdc' for ABC…

2. Executing Verilog-2005 frontend: /foss/designs/ALU/top.v
Parsing SystemVerilog input from `/foss/designs/ALU/top.v' to AST representation.
Storing AST representation for module `$abstract\top'.
Successfully finished Verilog frontend.

3. Executing Verilog-2005 frontend: /foss/designs/ALU/controller.v
Parsing SystemVerilog input from `/foss/designs/ALU/controller.v' to AST representation.
Storing AST representation for module `$abstract\controller'.
Successfully finished Verilog frontend.

4. Executing Verilog-2005 frontend: /foss/designs/ALU/ALU_7bit.v
Parsing SystemVerilog input from `/foss/designs/ALU/ALU_7bit.v' to AST representation.
Storing AST representation for module `$abstract\ALU_7bit'.
Successfully finished Verilog frontend.

5. Executing Verilog-2005 frontend: /foss/designs/ALU/ALU_SHR_7bit.v
Parsing SystemVerilog input from `/foss/designs/ALU/ALU_SHR_7bit.v' to AST representation.
Storing AST representation for module `$abstract\ALU_SHR_7bit'.
Successfully finished Verilog frontend.

6. Executing Verilog-2005 frontend: /foss/designs/ALU/ALU_NOT_7bit.v
Parsing SystemVerilog input from `/foss/designs/ALU/ALU_NOT_7bit.v' to AST representation.
Storing AST representation for module `$abstract\ALU_NOT_7bit'.
Successfully finished Verilog frontend.

7. Executing HIERARCHY pass (managing design hierarchy).

8. Executing AST frontend in derive mode using pre-parsed AST for module `\top'.
Generating RTLIL representation for module `\top'.

8.1. Analyzing design hierarchy..
Top module:  \top

8.2. Executing AST frontend in derive mode using pre-parsed AST for module `\ALU_7bit'.
Generating RTLIL representation for module `\ALU_7bit'.

8.3. Executing AST frontend in derive mode using pre-parsed AST for module `\controller'.
Generating RTLIL representation for module `\controller'.

8.4. Analyzing design hierarchy..
Top module:  \top
Used module:     \ALU_7bit
Used module:     \controller

8.5. Executing AST frontend in derive mode using pre-parsed AST for module `\ALU_SHR_7bit'.
Generating RTLIL representation for module `\ALU_SHR_7bit'.

8.6. Executing AST frontend in derive mode using pre-parsed AST for module `\ALU_NOT_7bit'.
Generating RTLIL representation for module `\ALU_NOT_7bit'.

8.7. Analyzing design hierarchy..
Top module:  \top
Used module:     \ALU_7bit
Used module:         \ALU_SHR_7bit
Used module:         \ALU_NOT_7bit
Used module:     \controller

8.8. Analyzing design hierarchy..
Top module:  \top
Used module:     \ALU_7bit
Used module:         \ALU_SHR_7bit
Used module:         \ALU_NOT_7bit
Used module:     \controller
Removing unused module `$abstract\ALU_NOT_7bit'.
Removing unused module `$abstract\ALU_SHR_7bit'.
Removing unused module `$abstract\ALU_7bit'.
Removing unused module `$abstract\controller'.
Removing unused module `$abstract\top'.
Removed 5 unused modules.
Renaming module top to top.

9. Generating Graphviz representation of design.
Writing dot description to `/foss/designs/ALU/runs/RUN_2025-06-08_18-02-53/06-yosys-synthesis/hierarchy.dot'.
Dumping module top to page 1.

10. Executing TRIBUF pass.

11. Executing HIERARCHY pass (managing design hierarchy).

11.1. Analyzing design hierarchy..
Top module:  \top
Used module:     \ALU_7bit
Used module:         \ALU_SHR_7bit
Used module:         \ALU_NOT_7bit
Used module:     \controller

11.2. Analyzing design hierarchy..
Top module:  \top
Used module:     \ALU_7bit
Used module:         \ALU_SHR_7bit
Used module:         \ALU_NOT_7bit
Used module:     \controller
Removed 0 unused modules.

12. Executing PROC_CLEAN pass (remove empty switches from decision trees).
Cleaned up 0 empty switches.

13. Executing PROC_RMDEAD pass (remove dead branches from decision trees).
Removed 1 dead cases from process $proc$/foss/designs/ALU/ALU_SHR_7bit.v:6$6 in module ALU_SHR_7bit.
Marked 1 switch rules as full_case in process $proc$/foss/designs/ALU/ALU_SHR_7bit.v:6$6 in module ALU_SHR_7bit.
Marked 1 switch rules as full_case in process $proc$/foss/designs/ALU/controller.v:22$5 in module controller.
Marked 1 switch rules as full_case in process $proc$/foss/designs/ALU/controller.v:14$4 in module controller.
Removed 1 dead cases from process $proc$/foss/designs/ALU/ALU_7bit.v:13$2 in module ALU_7bit.
Marked 1 switch rules as full_case in process $proc$/foss/designs/ALU/ALU_7bit.v:13$2 in module ALU_7bit.
Removed a total of 2 dead cases.

14. Executing PROC_PRUNE pass (remove redundant assignments in processes).
Removed 1 redundant assignment.
Promoted 6 assignments to connections.

15. Executing PROC_INIT pass (extract init attributes).

16. Executing PROC_ARST pass (detect async resets in processes).
Found async reset \reset in `\controller.$proc$/foss/designs/ALU/controller.v:14$4'.

17. Executing PROC_ROM pass (convert switches to ROMs).
Converted 0 switches.
<suppressed ~3 debug messages>

18. Executing PROC_MUX pass (convert decision trees to multiplexers).
Creating decoders for process `\ALU_SHR_7bit.$proc$/foss/designs/ALU/ALU_SHR_7bit.v:6$6'.
     1/1: $1\out[6:0]
Creating decoders for process `\controller.$proc$/foss/designs/ALU/controller.v:22$5'.
     1/4: $1\nstate[2:0]
     2/4: $1\OP[0:0]
     3/4: $1\B[6:0]
     4/4: $1\A[6:0]
Creating decoders for process `\controller.$proc$/foss/designs/ALU/controller.v:14$4'.
     1/1: $0\pstate[2:0]
Creating decoders for process `\ALU_7bit.$proc$/foss/designs/ALU/ALU_7bit.v:13$2'.
     1/1: $1\result[6:0]

19. Executing PROC_DLATCH pass (convert process syncs to latches).
No latch inferred for signal `\ALU_SHR_7bit.\out' from process `\ALU_SHR_7bit.$proc$/foss/designs/ALU/ALU_SHR_7bit.v:6$6'.
No latch inferred for signal `\controller.\A' from process `\controller.$proc$/foss/designs/ALU/controller.v:22$5'.
No latch inferred for signal `\controller.\B' from process `\controller.$proc$/foss/designs/ALU/controller.v:22$5'.
No latch inferred for signal `\controller.\OP' from process `\controller.$proc$/foss/designs/ALU/controller.v:22$5'.
No latch inferred for signal `\controller.\nstate' from process `\controller.$proc$/foss/designs/ALU/controller.v:22$5'.
No latch inferred for signal `\ALU_7bit.\result' from process `\ALU_7bit.$proc$/foss/designs/ALU/ALU_7bit.v:13$2'.

20. Executing PROC_DFF pass (convert process syncs to FFs).
Creating register for signal `\controller.\pstate' using process `\controller.$proc$/foss/designs/ALU/controller.v:14$4'.
  created $adff cell `$procdff$41' with positive edge clock and positive level reset.

21. Executing PROC_MEMWR pass (convert process memory writes to cells).

22. Executing PROC_CLEAN pass (remove empty switches from decision trees).
Found and cleaned up 1 empty switch in `\ALU_SHR_7bit.$proc$/foss/designs/ALU/ALU_SHR_7bit.v:6$6'.
Removing empty process `ALU_SHR_7bit.$proc$/foss/designs/ALU/ALU_SHR_7bit.v:6$6'.
Found and cleaned up 1 empty switch in `\controller.$proc$/foss/designs/ALU/controller.v:22$5'.
Removing empty process `controller.$proc$/foss/designs/ALU/controller.v:22$5'.
Removing empty process `controller.$proc$/foss/designs/ALU/controller.v:14$4'.
Found and cleaned up 1 empty switch in `\ALU_7bit.$proc$/foss/designs/ALU/ALU_7bit.v:13$2'.
Removing empty process `ALU_7bit.$proc$/foss/designs/ALU/ALU_7bit.v:13$2'.
Cleaned up 3 empty switches.

23. Executing CHECK pass (checking for obvious problems).
Checking module top...
Checking module ALU_SHR_7bit...
Checking module controller...
Checking module ALU_7bit...
Checking module ALU_NOT_7bit...
Found and reported 0 problems.

24. Executing OPT_EXPR pass (perform const folding).
Optimizing module top.
Optimizing module ALU_SHR_7bit.
<suppressed ~1 debug messages>
Optimizing module controller.
<suppressed ~2 debug messages>
Optimizing module ALU_7bit.
<suppressed ~2 debug messages>
Optimizing module ALU_NOT_7bit.

25. Executing FLATTEN pass (flatten design).
Deleting now unused module ALU_SHR_7bit.
Deleting now unused module controller.
Deleting now unused module ALU_7bit.
Deleting now unused module ALU_NOT_7bit.
<suppressed ~4 debug messages>

26. Executing OPT_EXPR pass (perform const folding).
Optimizing module top.

27. Executing OPT_CLEAN pass (remove unused cells and wires).
Finding unused cells or wires in module \top..
Removed 0 unused cells and 24 unused wires.
<suppressed ~1 debug messages>

28. Executing OPT_EXPR pass (perform const folding).
Optimizing module top.

29. Executing OPT_MERGE pass (detect identical cells).
Finding identical cells in module `\top'.
<suppressed ~12 debug messages>
Removed a total of 4 cells.

30. Executing OPT_MUXTREE pass (detect dead branches in mux trees).
Running muxtree optimizer on module \top..
  Creating internal representation of mux trees.
  Evaluating internal representation of mux trees.
  Analyzing evaluation results.
Removed 0 multiplexer ports.
<suppressed ~5 debug messages>

31. Executing OPT_REDUCE pass (consolidate $*mux and $reduce_* inputs).
  Optimizing cells in module \top.
Performed a total of 0 changes.

32. Executing OPT_MERGE pass (detect identical cells).
Finding identical cells in module `\top'.
Removed a total of 0 cells.

33. Executing OPT_DFF pass (perform DFF optimizations).

34. Executing OPT_CLEAN pass (remove unused cells and wires).
Finding unused cells or wires in module \top..
Removed 0 unused cells and 4 unused wires.
<suppressed ~1 debug messages>

35. Executing OPT_EXPR pass (perform const folding).
Optimizing module top.

36. Rerunning OPT passes. (Maybe there is more to do…)

37. Executing OPT_MUXTREE pass (detect dead branches in mux trees).
Running muxtree optimizer on module \top..
  Creating internal representation of mux trees.
  Evaluating internal representation of mux trees.
  Analyzing evaluation results.
Removed 0 multiplexer ports.
<suppressed ~5 debug messages>

38. Executing OPT_REDUCE pass (consolidate $*mux and $reduce_* inputs).
  Optimizing cells in module \top.
Performed a total of 0 changes.

39. Executing OPT_MERGE pass (detect identical cells).
Finding identical cells in module `\top'.
Removed a total of 0 cells.

40. Executing OPT_DFF pass (perform DFF optimizations).

41. Executing OPT_CLEAN pass (remove unused cells and wires).
Finding unused cells or wires in module \top..

42. Executing OPT_EXPR pass (perform const folding).
Optimizing module top.

43. Executing FSM pass (extract and optimize FSM).

43.1. Executing FSM_DETECT pass (finding FSMs in design).
Not marking top.controller_inst.pstate as FSM state register:
    Circuit seems to be self-resetting.

43.2. Executing FSM_EXTRACT pass (extracting FSM from design).

43.3. Executing FSM_OPT pass (simple optimizations of FSMs).

43.4. Executing OPT_CLEAN pass (remove unused cells and wires).
Finding unused cells or wires in module \top..

43.5. Executing FSM_OPT pass (simple optimizations of FSMs).

43.6. Executing FSM_RECODE pass (re-assigning FSM state encoding).

43.7. Executing FSM_INFO pass (dumping all available information on FSM cells).

43.8. Executing FSM_MAP pass (mapping FSMs to basic logic).

44. Executing OPT_EXPR pass (perform const folding).
Optimizing module top.

45. Executing OPT_MERGE pass (detect identical cells).
Finding identical cells in module `\top'.
Removed a total of 0 cells.

46. Executing OPT_MUXTREE pass (detect dead branches in mux trees).
Running muxtree optimizer on module \top..
  Creating internal representation of mux trees.
  Evaluating internal representation of mux trees.
  Analyzing evaluation results.
Removed 0 multiplexer ports.
<suppressed ~5 debug messages>

47. Executing OPT_REDUCE pass (consolidate $*mux and $reduce_* inputs).
  Optimizing cells in module \top.
Performed a total of 0 changes.

48. Executing OPT_MERGE pass (detect identical cells).
Finding identical cells in module `\top'.
Removed a total of 0 cells.

49. Executing OPT_DFF pass (perform DFF optimizations).

50. Executing OPT_CLEAN pass (remove unused cells and wires).
Finding unused cells or wires in module \top..

51. Executing OPT_EXPR pass (perform const folding).
Optimizing module top.

52. Executing WREDUCE pass (reducing word size of cells).
Removed top 5 bits (of 7) from mux cell top.$flatten\controller_inst.$procmux$29 ($mux).
Removed top 2 bits (of 3) from port B of cell top.$flatten\controller_inst.$procmux$21_CMP0 ($eq).
Removed top 1 bits (of 3) from mux cell top.$flatten\controller_inst.$procmux$19 ($pmux).
Removed top 1 bits (of 3) from port B of cell top.$flatten\controller_inst.$procmux$20_CMP0 ($eq).
Removed top 1 bits (of 3) from port A of cell top.$flatten\alu_inst.\SHR1.$procmux$10_CMP0 ($eq).
Removed top 1 bits (of 3) from port A of cell top.$flatten\alu_inst.\SHR1.$procmux$11_CMP0 ($eq).
Removed top 1 bits (of 3) from port A of cell top.$flatten\alu_inst.\SHR1.$procmux$12_CMP0 ($eq).
Removed top 1 bits (of 3) from port A of cell top.$flatten\alu_inst.\SHR1.$procmux$13_CMP0 ($eq).
Removed top 1 bits (of 3) from port B of cell top.$flatten\alu_inst.\SHR1.$procmux$13_CMP0 ($eq).
Removed top 1 bits (of 3) from port A of cell top.$flatten\alu_inst.\SHR1.$procmux$14_CMP0 ($eq).
Removed top 1 bits (of 3) from port B of cell top.$flatten\alu_inst.\SHR1.$procmux$14_CMP0 ($eq).
Removed top 1 bits (of 3) from port A of cell top.$flatten\alu_inst.\SHR1.$procmux$15_CMP0 ($eq).
Removed top 2 bits (of 3) from port B of cell top.$flatten\alu_inst.\SHR1.$procmux$15_CMP0 ($eq).
Removed top 1 bits (of 3) from port A of cell top.$flatten\alu_inst.\SHR1.$procmux$9_CMP0 ($eq).
Removed top 5 bits (of 7) from wire top.B.

53. Executing PEEPOPT pass (run peephole optimizers).

54. Executing OPT_CLEAN pass (remove unused cells and wires).
Finding unused cells or wires in module \top..
Removed 0 unused cells and 1 unused wires.
<suppressed ~1 debug messages>

55. Executing ALUMACC pass (create $alu and $macc cells).
Extracting $alu and $macc cells in module top:
  created 0 $alu and 0 $macc cells.

56. Executing SHARE pass (SAT-based resource sharing).

57. Executing OPT_EXPR pass (perform const folding).
Optimizing module top.
<suppressed ~4 debug messages>

58. Executing OPT_MERGE pass (detect identical cells).
Finding identical cells in module `\top'.
Removed a total of 0 cells.

59. Executing OPT_MUXTREE pass (detect dead branches in mux trees).
Running muxtree optimizer on module \top..
  Creating internal representation of mux trees.
  Evaluating internal representation of mux trees.
  Analyzing evaluation results.
    dead port 1/9 on $pmux $flatten\alu_inst.\SHR1.$procmux$8.
    dead port 2/9 on $pmux $flatten\alu_inst.\SHR1.$procmux$8.
    dead port 3/9 on $pmux $flatten\alu_inst.\SHR1.$procmux$8.
    dead port 4/9 on $pmux $flatten\alu_inst.\SHR1.$procmux$8.
Removed 4 multiplexer ports.
<suppressed ~5 debug messages>

60. Executing OPT_REDUCE pass (consolidate $*mux and $reduce_* inputs).
  Optimizing cells in module \top.
Performed a total of 0 changes.

61. Executing OPT_MERGE pass (detect identical cells).
Finding identical cells in module `\top'.
Removed a total of 0 cells.

62. Executing OPT_DFF pass (perform DFF optimizations).
Setting constant 0-bit at position 2 on $flatten\controller_inst.$procdff$41 ($adff) from module top.

63. Executing OPT_CLEAN pass (remove unused cells and wires).
Finding unused cells or wires in module \top..
Removed 0 unused cells and 4 unused wires.
<suppressed ~1 debug messages>

64. Executing OPT_EXPR pass (perform const folding).
Optimizing module top.

65. Rerunning OPT passes. (Maybe there is more to do…)

66. Executing OPT_MUXTREE pass (detect dead branches in mux trees).
Running muxtree optimizer on module \top..
  Creating internal representation of mux trees.
  Evaluating internal representation of mux trees.
  Analyzing evaluation results.
Removed 0 multiplexer ports.
<suppressed ~5 debug messages>

67. Executing OPT_REDUCE pass (consolidate $*mux and $reduce_* inputs).
  Optimizing cells in module \top.
Performed a total of 0 changes.

68. Executing OPT_MERGE pass (detect identical cells).
Finding identical cells in module `\top'.
Removed a total of 0 cells.

69. Executing OPT_DFF pass (perform DFF optimizations).

70. Executing OPT_CLEAN pass (remove unused cells and wires).
Finding unused cells or wires in module \top..

71. Executing OPT_EXPR pass (perform const folding).
Optimizing module top.

72. Executing MEMORY pass.

72.1. Executing OPT_MEM pass (optimize memories).
Performed a total of 0 transformations.

72.2. Executing OPT_MEM_PRIORITY pass (removing unnecessary memory write priority relations).
Performed a total of 0 transformations.

72.3. Executing OPT_MEM_FEEDBACK pass (finding memory read-to-write feedback paths).

72.4. Executing MEMORY_BMUX2ROM pass (converting muxes to ROMs).

72.5. Executing MEMORY_DFF pass (merging $dff cells to $memrd).

72.6. Executing OPT_CLEAN pass (remove unused cells and wires).
Finding unused cells or wires in module \top..

72.7. Executing MEMORY_SHARE pass (consolidating $memrd/$memwr cells).

72.8. Executing OPT_MEM_WIDEN pass (optimize memories where all ports are wide).
Performed a total of 0 transformations.

72.9. Executing OPT_CLEAN pass (remove unused cells and wires).
Finding unused cells or wires in module \top..

72.10. Executing MEMORY_COLLECT pass (generating $mem cells).

73. Executing OPT_CLEAN pass (remove unused cells and wires).
Finding unused cells or wires in module \top..

74. Executing OPT_EXPR pass (perform const folding).
Optimizing module top.
<suppressed ~5 debug messages>

75. Executing OPT_MERGE pass (detect identical cells).
Finding identical cells in module `\top'.
Removed a total of 0 cells.

76. Executing OPT_DFF pass (perform DFF optimizations).

77. Executing OPT_CLEAN pass (remove unused cells and wires).
Finding unused cells or wires in module \top..
Removed 2 unused cells and 3 unused wires.
<suppressed ~3 debug messages>

78. Executing MEMORY_MAP pass (converting memories to logic and flip-flops).

79. Executing OPT_EXPR pass (perform const folding).
Optimizing module top.

80. Executing OPT_MERGE pass (detect identical cells).
Finding identical cells in module `\top'.
Removed a total of 0 cells.

81. Executing OPT_MUXTREE pass (detect dead branches in mux trees).
Running muxtree optimizer on module \top..
  Creating internal representation of mux trees.
  Evaluating internal representation of mux trees.
  Analyzing evaluation results.
Removed 0 multiplexer ports.
<suppressed ~4 debug messages>

82. Executing OPT_REDUCE pass (consolidate $*mux and $reduce_* inputs).
  Optimizing cells in module \top.
    Consolidated identical input bits for $mux cell $flatten\controller_inst.$procmux$29:
      Old ports: A=2'00, B=2'11, Y=\B
      New ports: A=1'0, B=1'1, Y=\B [0]
      New connections: \B [1] = \B [0]
    Consolidated identical input bits for $pmux cell $flatten\controller_inst.$procmux$33:
      Old ports: A=7'0000000, B=14'10101011100110, Y=\alu_inst.NOT1.A
      New ports: A=3'000, B=6'101110, Y=\alu_inst.NOT1.A [2:0]
      New connections: \alu_inst.NOT1.A [6:3] = { \alu_inst.NOT1.A [2:0] 1'0 }
  Optimizing cells in module \top.
    Consolidated identical input bits for $pmux cell $flatten\alu_inst.\SHR1.$procmux$8:
      Old ports: A=\alu_inst.NOT1.A, B={ 1'0 \alu_inst.NOT1.A [6:1] 2'00 \alu_inst.NOT1.A [6:2] 3'000 \alu_inst.NOT1.A [6:3] }, Y=\alu_inst.R_SHR
      New ports: A={ \alu_inst.NOT1.A [2:1] 1'0 \alu_inst.NOT1.A [2:0] }, B={ 1'0 \alu_inst.NOT1.A [2] \alu_inst.NOT1.A [0] 1'0 \alu_inst.NOT1.A [2:1] 2'00 \alu_inst.NOT1.A [1:0] 1'0 \alu_inst.NOT1.A [2] 2'00 \alu_inst.NOT1.A [2:0] 1'0 }, Y={ \alu_inst.R_SHR [6:5] \alu_inst.R_SHR [3:0] }
      New connections: \alu_inst.R_SHR [4] = \alu_inst.R_SHR [0]
  Optimizing cells in module \top.
Performed a total of 3 changes.

83. Executing OPT_MERGE pass (detect identical cells).
Finding identical cells in module `\top'.
Removed a total of 0 cells.

84. Executing OPT_SHARE pass.

85. Executing OPT_DFF pass (perform DFF optimizations).

86. Executing OPT_CLEAN pass (remove unused cells and wires).
Finding unused cells or wires in module \top..

87. Executing OPT_EXPR pass (perform const folding).
Optimizing module top.
<suppressed ~11 debug messages>

88. Rerunning OPT passes. (Maybe there is more to do…)

89. Executing OPT_MUXTREE pass (detect dead branches in mux trees).
Running muxtree optimizer on module \top..
  Creating internal representation of mux trees.
  Evaluating internal representation of mux trees.
  Analyzing evaluation results.
    dead port 2/4 on $pmux $flatten\alu_inst.\SHR1.$procmux$8.
    dead port 3/4 on $pmux $flatten\alu_inst.\SHR1.$procmux$8.
    dead port 4/4 on $pmux $flatten\alu_inst.\SHR1.$procmux$8.
Removed 3 multiplexer ports.
<suppressed ~3 debug messages>

90. Executing OPT_REDUCE pass (consolidate $*mux and $reduce_* inputs).
  Optimizing cells in module \top.
    Consolidated identical input bits for $mux cell $flatten\alu_inst.$procmux$36:
      Old ports: A=\alu_inst.R_NOT, B={ \alu_inst.R_SHR [6:1] \alu_inst.R_SHR [4] }, Y=\alu_inst.result
      New ports: A={ $auto$opt_expr.cc:205:group_cell_inputs$48 [2:1] 1'1 $auto$opt_expr.cc:205:group_cell_inputs$48 }, B={ 2'00 \alu_inst.NOT1.A [6:4] 1'0 }, Y={ \alu_inst.result [6:5] \alu_inst.result [3:0] }
      New connections: \alu_inst.result [4] = \alu_inst.result [0]
  Optimizing cells in module \top.
Performed a total of 1 changes.

91. Executing OPT_MERGE pass (detect identical cells).
Finding identical cells in module `\top'.
Removed a total of 0 cells.

92. Executing OPT_SHARE pass.

93. Executing OPT_DFF pass (perform DFF optimizations).

94. Executing OPT_CLEAN pass (remove unused cells and wires).
Finding unused cells or wires in module \top..
Removed 0 unused cells and 5 unused wires.
<suppressed ~1 debug messages>

95. Executing OPT_EXPR pass (perform const folding).
Optimizing module top.

96. Rerunning OPT passes. (Maybe there is more to do…)

97. Executing OPT_MUXTREE pass (detect dead branches in mux trees).
Running muxtree optimizer on module \top..
  Creating internal representation of mux trees.
  Evaluating internal representation of mux trees.
  Analyzing evaluation results.
Removed 0 multiplexer ports.
<suppressed ~3 debug messages>

98. Executing OPT_REDUCE pass (consolidate $*mux and $reduce_* inputs).
  Optimizing cells in module \top.
Performed a total of 0 changes.

99. Executing OPT_MERGE pass (detect identical cells).
Finding identical cells in module `\top'.
Removed a total of 0 cells.

100. Executing OPT_SHARE pass.

101. Executing OPT_DFF pass (perform DFF optimizations).

102. Executing OPT_CLEAN pass (remove unused cells and wires).
Finding unused cells or wires in module \top..

103. Executing OPT_EXPR pass (perform const folding).
Optimizing module top.

104. Executing TECHMAP pass (map to technology primitives).

104.1. Executing Verilog-2005 frontend: /foss/tools/yosys/bin/../share/yosys/techmap.v
Parsing Verilog input from `/foss/tools/yosys/bin/../share/yosys/techmap.v' to AST representation.
Generating RTLIL representation for module `\_90_simplemap_bool_ops'.
Generating RTLIL representation for module `\_90_simplemap_reduce_ops'.
Generating RTLIL representation for module `\_90_simplemap_logic_ops'.
Generating RTLIL representation for module `\_90_simplemap_compare_ops'.
Generating RTLIL representation for module `\_90_simplemap_various'.
Generating RTLIL representation for module `\_90_simplemap_registers'.
Generating RTLIL representation for module `\_90_shift_ops_shr_shl_sshl_sshr'.
Generating RTLIL representation for module `\_90_shift_shiftx'.
Generating RTLIL representation for module `\_90_fa'.
Generating RTLIL representation for module `\_90_lcu_brent_kung'.
Generating RTLIL representation for module `\_90_alu'.
Generating RTLIL representation for module `\_90_macc'.
Generating RTLIL representation for module `\_90_alumacc'.
Generating RTLIL representation for module `\$__div_mod_u'.
Generating RTLIL representation for module `\$__div_mod_trunc'.
Generating RTLIL representation for module `\_90_div'.
Generating RTLIL representation for module `\_90_mod'.
Generating RTLIL representation for module `\$__div_mod_floor'.
Generating RTLIL representation for module `\_90_divfloor'.
Generating RTLIL representation for module `\_90_modfloor'.
Generating RTLIL representation for module `\_90_pow'.
Generating RTLIL representation for module `\_90_pmux'.
Generating RTLIL representation for module `\_90_demux'.
Generating RTLIL representation for module `\_90_lut'.
Successfully finished Verilog frontend.

104.2. Continuing TECHMAP pass.
Using extmapper simplemap for cells of type $not.
Using template $paramod$32e7c4d6f92ff4337599ece53082d2e88a82a9f2\_90_pmux for cells of type $pmux.
Using extmapper simplemap for cells of type $logic_not.
Using extmapper simplemap for cells of type $eq.
Using template $paramod$97565c3687be688407d1272a293bd9d0ae6852dc\_90_pmux for cells of type $pmux.
Using extmapper simplemap for cells of type $mux.
Using extmapper simplemap for cells of type $adff.
Using extmapper simplemap for cells of type $reduce_or.
Using extmapper simplemap for cells of type $and.
No more expansions possible.
<suppressed ~125 debug messages>

105. Executing OPT_EXPR pass (perform const folding).
Optimizing module top.
<suppressed ~27 debug messages>

106. Executing OPT_MERGE pass (detect identical cells).
Finding identical cells in module `\top'.
<suppressed ~9 debug messages>
Removed a total of 3 cells.

107. Executing OPT_DFF pass (perform DFF optimizations).

108. Executing OPT_CLEAN pass (remove unused cells and wires).
Finding unused cells or wires in module \top..
Removed 1 unused cells and 47 unused wires.
<suppressed ~4 debug messages>

109. Executing OPT_EXPR pass (perform const folding).
Optimizing module top.

110. Executing OPT_MERGE pass (detect identical cells).
Finding identical cells in module `\top'.
Removed a total of 0 cells.

111. Executing OPT_DFF pass (perform DFF optimizations).

112. Executing OPT_CLEAN pass (remove unused cells and wires).
Finding unused cells or wires in module \top..

113. Executing ABC pass (technology mapping using ABC).

113.1. Extracting gate netlist of module `\top' to `<abc-temp-dir>/input.blif'..
Extracted 31 gates and 35 wires to a netlist network with 2 inputs and 9 outputs.

113.1.1. Executing ABC.
Running ABC command: "<yosys-exe-dir>/yosys-abc" -s -f <abc-temp-dir>/abc.script 2>&1
ABC: ABC command line: "source <abc-temp-dir>/abc.script".
ABC: 
ABC: + read_blif <abc-temp-dir>/input.blif 
ABC: + read_library <abc-temp-dir>/stdcells.genlib 
ABC: + strash 
ABC: + dretime 
ABC: + map 
ABC: + write_blif <abc-temp-dir>/output.blif 

113.1.2. Re-integrating ABC results.
ABC RESULTS:               AND cells:        1
ABC RESULTS:            ANDNOT cells:        3
ABC RESULTS:              NAND cells:        1
ABC RESULTS:                OR cells:        5
ABC RESULTS:             ORNOT cells:        6
ABC RESULTS:              XNOR cells:        1
ABC RESULTS:               XOR cells:        1
ABC RESULTS:        internal signals:       24
ABC RESULTS:           input signals:        2
ABC RESULTS:          output signals:        9
Removing temp directory.

114. Executing OPT pass (performing simple optimizations).

114.1. Executing OPT_EXPR pass (perform const folding).
Optimizing module top.

114.2. Executing OPT_MERGE pass (detect identical cells).
Finding identical cells in module `\top'.
<suppressed ~15 debug messages>
Removed a total of 5 cells.

114.3. Executing OPT_DFF pass (perform DFF optimizations).

114.4. Executing OPT_CLEAN pass (remove unused cells and wires).
Finding unused cells or wires in module \top..
Removed 0 unused cells and 25 unused wires.
<suppressed ~1 debug messages>

114.5. Finished fast OPT passes.

115. Executing HIERARCHY pass (managing design hierarchy).

115.1. Analyzing design hierarchy..
Top module:  \top

115.2. Analyzing design hierarchy..
Top module:  \top
Removed 0 unused modules.

116. Executing CHECK pass (checking for obvious problems).
Checking module top...
Found and reported 0 problems.

117. Printing statistics.

=== top ===

   Number of wires:                 31
   Number of wire bits:            122
   Number of public wires:          26
   Number of public wire bits:     117
   Number of ports:                  4
   Number of port bits:             10
   Number of memories:               0
   Number of memory bits:            0
   Number of processes:              0
   Number of cells:                 19
     $_ANDNOT_                       3
     $_AND_                          1
     $_DFF_PP0_                      2
     $_NAND_                         1
     $_ORNOT_                        2
     $_OR_                           4
     $_XNOR_                         1
     $_XOR_                          1
     $scopeinfo                      4

118. Generating Graphviz representation of design.
Writing dot description to `/foss/designs/ALU/runs/RUN_2025-06-08_18-02-53/06-yosys-synthesis/primitive_techmap.dot'.
Dumping module top to page 1.

119. Executing OPT pass (performing simple optimizations).

119.1. Executing OPT_EXPR pass (perform const folding).
Optimizing module top.

119.2. Executing OPT_MERGE pass (detect identical cells).
Finding identical cells in module `\top'.
Removed a total of 0 cells.

119.3. Executing OPT_MUXTREE pass (detect dead branches in mux trees).
Running muxtree optimizer on module \top..
  Creating internal representation of mux trees.
  No muxes found in this module.
Removed 0 multiplexer ports.

119.4. Executing OPT_REDUCE pass (consolidate $*mux and $reduce_* inputs).
  Optimizing cells in module \top.
Performed a total of 0 changes.

119.5. Executing OPT_MERGE pass (detect identical cells).
Finding identical cells in module `\top'.
Removed a total of 0 cells.

119.6. Executing OPT_DFF pass (perform DFF optimizations).

119.7. Executing OPT_CLEAN pass (remove unused cells and wires).
Finding unused cells or wires in module \top..

119.8. Executing OPT_EXPR pass (perform const folding).
Optimizing module top.

119.9. Finished OPT passes. (There is nothing left to do.)

120. Executing OPT_CLEAN pass (remove unused cells and wires).
Finding unused cells or wires in module \top..
Removed 4 unused cells and 20 unused wires.
<suppressed ~24 debug messages>
{
   "creator": "Yosys 0.53 (git sha1 53c22ab7c, g++ 13.3.0-6ubuntu2~24.04 -fPIC -O3)",
   "invocation": "stat -json -liberty /foss/designs/ALU/runs/RUN_2025-06-08_18-02-53/tmp/3b9a99ebdd5b45e081038bb96c7f5eaf.lib ",
   "modules": {
      "\\top": {
         "num_wires":         11,
         "num_wire_bits":     21,
         "num_pub_wires":     6,
         "num_pub_wire_bits": 16,
         "num_ports":         4,
         "num_port_bits":     10,
         "num_memories":      0,
         "num_memory_bits":   0,
         "num_processes":     0,
         "num_cells":         15,
         "num_cells_by_type": {
            "$_ANDNOT_": 3,
            "$_AND_": 1,
            "$_DFF_PP0_": 2,
            "$_NAND_": 1,
            "$_ORNOT_": 2,
            "$_OR_": 4,
            "$_XNOR_": 1,
            "$_XOR_": 1
         }
      }
   },
      "design": {
         "num_wires":         11,
         "num_wire_bits":     21,
         "num_pub_wires":     6,
         "num_pub_wire_bits": 16,
         "num_ports":         4,
         "num_port_bits":     10,
         "num_memories":      0,
         "num_memory_bits":   0,
         "num_processes":     0,
         "num_cells":         15,
         "num_cells_by_type": {
            "$_ANDNOT_": 3,
            "$_AND_": 1,
            "$_DFF_PP0_": 2,
            "$_NAND_": 1,
            "$_ORNOT_": 2,
            "$_OR_": 4,
            "$_XNOR_": 1,
            "$_XOR_": 1
         }
      }
}

121. Printing statistics.

=== top ===

   Number of wires:                 11
   Number of wire bits:             21
   Number of public wires:           6
   Number of public wire bits:      16
   Number of ports:                  4
   Number of port bits:             10
   Number of memories:               0
   Number of memory bits:            0
   Number of processes:              0
   Number of cells:                 15
     $_ANDNOT_                       3
     $_AND_                          1
     $_DFF_PP0_                      2
     $_NAND_                         1
     $_ORNOT_                        2
     $_OR_                           4
     $_XNOR_                         1
     $_XOR_                          1

   Area for cell type $_AND_ is unknown!
   Area for cell type $_NAND_ is unknown!
   Area for cell type $_OR_ is unknown!
   Area for cell type $_XOR_ is unknown!
   Area for cell type $_XNOR_ is unknown!
   Area for cell type $_ANDNOT_ is unknown!
   Area for cell type $_ORNOT_ is unknown!
   Area for cell type $_DFF_PP0_ is unknown!

[INFO] Applying tri-state buffer mapping from '/foss/pdks/sky130A/libs.tech/openlane/sky130_fd_sc_hd/tribuff_map.v'…

122. Executing TECHMAP pass (map to technology primitives).

122.1. Executing Verilog-2005 frontend: /foss/pdks/sky130A/libs.tech/openlane/sky130_fd_sc_hd/tribuff_map.v
Parsing Verilog input from `/foss/pdks/sky130A/libs.tech/openlane/sky130_fd_sc_hd/tribuff_map.v' to AST representation.
Generating RTLIL representation for module `\$_TBUF_'.
Successfully finished Verilog frontend.

122.2. Continuing TECHMAP pass.
No more expansions possible.
<suppressed ~3 debug messages>

123. Executing SIMPLEMAP pass (map simple cells to gate primitives).
[INFO] Applying latch mapping from '/foss/pdks/sky130A/libs.tech/openlane/sky130_fd_sc_hd/latch_map.v'…

124. Executing TECHMAP pass (map to technology primitives).

124.1. Executing Verilog-2005 frontend: /foss/pdks/sky130A/libs.tech/openlane/sky130_fd_sc_hd/latch_map.v
Parsing Verilog input from `/foss/pdks/sky130A/libs.tech/openlane/sky130_fd_sc_hd/latch_map.v' to AST representation.
Generating RTLIL representation for module `\$_DLATCH_P_'.
Generating RTLIL representation for module `\$_DLATCH_N_'.
Successfully finished Verilog frontend.

124.2. Continuing TECHMAP pass.
No more expansions possible.
<suppressed ~4 debug messages>

125. Executing SIMPLEMAP pass (map simple cells to gate primitives).

126. Executing DFFLIBMAP pass (mapping DFF cells to sequential cells from liberty file).
  cell sky130_fd_sc_hd__dfxtp_2 (noninv, pins=3, area=21.27) is a direct match for cell type $_DFF_P_.
  cell sky130_fd_sc_hd__dfrtp_2 (noninv, pins=4, area=26.28) is a direct match for cell type $_DFF_PN0_.
  cell sky130_fd_sc_hd__dfstp_2 (noninv, pins=4, area=26.28) is a direct match for cell type $_DFF_PN1_.
  cell sky130_fd_sc_hd__dfbbn_2 (noninv, pins=6, area=35.03) is a direct match for cell type $_DFFSR_NNN_.
  final dff cell mappings:
    unmapped dff cell: $_DFF_N_
    \sky130_fd_sc_hd__dfxtp_2 _DFF_P_ (.CLK( C), .D( D), .Q( Q));
    unmapped dff cell: $_DFF_NN0_
    unmapped dff cell: $_DFF_NN1_
    unmapped dff cell: $_DFF_NP0_
    unmapped dff cell: $_DFF_NP1_
    \sky130_fd_sc_hd__dfrtp_2 _DFF_PN0_ (.CLK( C), .D( D), .Q( Q), .RESET_B( R));
    \sky130_fd_sc_hd__dfstp_2 _DFF_PN1_ (.CLK( C), .D( D), .Q( Q), .SET_B( R));
    unmapped dff cell: $_DFF_PP0_
    unmapped dff cell: $_DFF_PP1_
    unmapped dff cell: $_DFFE_NN_
    unmapped dff cell: $_DFFE_NP_
    unmapped dff cell: $_DFFE_PN_
    unmapped dff cell: $_DFFE_PP_
    \sky130_fd_sc_hd__dfbbn_2 _DFFSR_NNN_ (.CLK_N( C), .D( D), .Q( Q), .Q_N(~Q), .RESET_B( R), .SET_B( S));
    unmapped dff cell: $_DFFSR_NNP_
    unmapped dff cell: $_DFFSR_NPN_
    unmapped dff cell: $_DFFSR_NPP_
    unmapped dff cell: $_DFFSR_PNN_
    unmapped dff cell: $_DFFSR_PNP_
    unmapped dff cell: $_DFFSR_PPN_
    unmapped dff cell: $_DFFSR_PPP_

126.1. Executing DFFLEGALIZE pass (convert FFs to types supported by the target).
Mapping DFF cells in module `\top':
  mapped 2 $_DFF_PN0_ cells to \sky130_fd_sc_hd__dfrtp_2 cells.
{
   "creator": "Yosys 0.53 (git sha1 53c22ab7c, g++ 13.3.0-6ubuntu2~24.04 -fPIC -O3)",
   "invocation": "stat -json -liberty /foss/designs/ALU/runs/RUN_2025-06-08_18-02-53/tmp/3b9a99ebdd5b45e081038bb96c7f5eaf.lib ",
   "modules": {
      "\\top": {
         "num_wires":         13,
         "num_wire_bits":     23,
         "num_pub_wires":     6,
         "num_pub_wire_bits": 16,
         "num_ports":         4,
         "num_port_bits":     10,
         "num_memories":      0,
         "num_memory_bits":   0,
         "num_processes":     0,
         "num_cells":         17,
         "area":              52.550400,
         "num_cells_by_type": {
            "$_ANDNOT_": 3,
            "$_AND_": 1,
            "$_NAND_": 1,
            "$_NOT_": 2,
            "$_ORNOT_": 2,
            "$_OR_": 4,
            "$_XNOR_": 1,
            "$_XOR_": 1,
            "sky130_fd_sc_hd__dfrtp_2": 2
         }
      }
   },
      "design": {
         "num_wires":         13,
         "num_wire_bits":     23,
         "num_pub_wires":     6,
         "num_pub_wire_bits": 16,
         "num_ports":         4,
         "num_port_bits":     10,
         "num_memories":      0,
         "num_memory_bits":   0,
         "num_processes":     0,
         "num_cells":         17,
         "area":              52.550400,
         "num_cells_by_type": {
            "$_ANDNOT_": 3,
            "$_AND_": 1,
            "$_NAND_": 1,
            "$_NOT_": 2,
            "$_ORNOT_": 2,
            "$_OR_": 4,
            "$_XNOR_": 1,
            "$_XOR_": 1,
            "sky130_fd_sc_hd__dfrtp_2": 2
         }
      }
}

127. Printing statistics.

=== top ===

   Number of wires:                 13
   Number of wire bits:             23
   Number of public wires:           6
   Number of public wire bits:      16
   Number of ports:                  4
   Number of port bits:             10
   Number of memories:               0
   Number of memory bits:            0
   Number of processes:              0
   Number of cells:                 17
     $_ANDNOT_                       3
     $_AND_                          1
     $_NAND_                         1
     $_NOT_                          2
     $_ORNOT_                        2
     $_OR_                           4
     $_XNOR_                         1
     $_XOR_                          1
     sky130_fd_sc_hd__dfrtp_2        2

   Area for cell type $_NOT_ is unknown!
   Area for cell type $_AND_ is unknown!
   Area for cell type $_NAND_ is unknown!
   Area for cell type $_OR_ is unknown!
   Area for cell type $_XOR_ is unknown!
   Area for cell type $_XNOR_ is unknown!
   Area for cell type $_ANDNOT_ is unknown!
   Area for cell type $_ORNOT_ is unknown!

   Chip area for module '\top': 52.550400
     of which used for sequential elements: 52.550400 (100.00%)

[INFO] Using generated ABC script '/foss/designs/ALU/runs/RUN_2025-06-08_18-02-53/06-yosys-synthesis/DELAY_4.abc'…

128. Executing ABC pass (technology mapping using ABC).

128.1. Extracting gate netlist of module `\top' to `/tmp/yosys-abc-DJaKhV/input.blif'..
Extracted 15 gates and 18 wires to a netlist network with 3 inputs and 10 outputs.

128.1.1. Executing ABC.
Running ABC command: "/foss/tools/yosys/bin/yosys-abc" -s -f /tmp/yosys-abc-DJaKhV/abc.script 2>&1
ABC: ABC command line: "source /tmp/yosys-abc-DJaKhV/abc.script".
ABC: 
ABC: + read_blif /tmp/yosys-abc-DJaKhV/input.blif 
ABC: + read_lib -w /foss/designs/ALU/runs/RUN_2025-06-08_18-02-53/tmp/3b9a99ebdd5b45e081038bb96c7f5eaf.lib 
ABC: Parsing finished successfully.  Parsing time =     0.04 sec
ABC: Scl_LibertyReadGenlib() skipped sequential cell "sky130_fd_sc_hd__dfbbn_2".
ABC: Scl_LibertyReadGenlib() skipped sequential cell "sky130_fd_sc_hd__dfrbp_2".
ABC: Scl_LibertyReadGenlib() skipped sequential cell "sky130_fd_sc_hd__dfrtp_2".
ABC: Scl_LibertyReadGenlib() skipped sequential cell "sky130_fd_sc_hd__dfrtp_4".
ABC: Scl_LibertyReadGenlib() skipped sequential cell "sky130_fd_sc_hd__dfsbp_2".
ABC: Scl_LibertyReadGenlib() skipped sequential cell "sky130_fd_sc_hd__dfstp_2".
ABC: Scl_LibertyReadGenlib() skipped sequential cell "sky130_fd_sc_hd__dfstp_4".
ABC: Scl_LibertyReadGenlib() skipped sequential cell "sky130_fd_sc_hd__dfxbp_2".
ABC: Scl_LibertyReadGenlib() skipped sequential cell "sky130_fd_sc_hd__dfxtp_2".
ABC: Scl_LibertyReadGenlib() skipped sequential cell "sky130_fd_sc_hd__dfxtp_4".
ABC: Scl_LibertyReadGenlib() skipped sequential cell "sky130_fd_sc_hd__dlxtn_1".
ABC: Scl_LibertyReadGenlib() skipped sequential cell "sky130_fd_sc_hd__dlxtn_2".
ABC: Scl_LibertyReadGenlib() skipped sequential cell "sky130_fd_sc_hd__dlxtn_4".
ABC: Scl_LibertyReadGenlib() skipped sequential cell "sky130_fd_sc_hd__dlxtp_1".
ABC: Scl_LibertyReadGenlib() skipped three-state cell "sky130_fd_sc_hd__ebufn_2".
ABC: Scl_LibertyReadGenlib() skipped three-state cell "sky130_fd_sc_hd__ebufn_4".
ABC: Scl_LibertyReadGenlib() skipped three-state cell "sky130_fd_sc_hd__ebufn_8".
ABC: Library "sky130_fd_sc_hd__tt_025C_1v80" from "/foss/designs/ALU/runs/RUN_2025-06-08_18-02-53/tmp/3b9a99ebdd5b45e081038bb96c7f5eaf.lib" has 175 cells (17 skipped: 14 seq; 3 tri-state; 0 no func; 0 dont_use).  Time =     0.06 sec
ABC: Memory =    9.54 MB. Time =     0.06 sec
ABC: Warning: Detected 2 multi-output gates (for example, "sky130_fd_sc_hd__fa_1").
ABC: + read_constr -v /foss/designs/ALU/runs/RUN_2025-06-08_18-02-53/06-yosys-synthesis/synthesis.abc.sdc 
ABC: Setting driving cell to be "sky130_fd_sc_hd__inv_2/Y".
ABC: Setting output load to be 33.442001.
ABC: + source /foss/designs/ALU/runs/RUN_2025-06-08_18-02-53/06-yosys-synthesis/DELAY_4.abc 
ABC: Cannot find the default PI driving cell (sky130_fd_sc_hd__inv_2/Y) in the library.
ABC: Cannot find the default PI driving cell (sky130_fd_sc_hd__inv_2/Y) in the library.
ABC: WireLoad = "Small"  Gates =     12 ( 41.7 %)   Cap = 27.2 ff ( 16.2 %)   Area =      100.10 ( 41.7 %)   Delay =   421.42 ps  ( 33.3 %)               
ABC: Cannot find the default PI driving cell (sky130_fd_sc_hd__inv_2/Y) in the library.
ABC: Cannot find the default PI driving cell (sky130_fd_sc_hd__inv_2/Y) in the library.
ABC: Cannot find the default PI driving cell (sky130_fd_sc_hd__inv_2/Y) in the library.
ABC: WireLoad = "none"  Gates =     12 ( 41.7 %)   Cap = 31.6 ff ( 46.2 %)   Area =      143.89 (  0.0 %)   Delay =   267.52 ps  ( 25.0 %)               
ABC: Path  0 --       1 : 0    5 pi                       A =   0.00  Df =   0.0   -0.0 ps  S =   0.0 ps  Cin =  0.0 ff  Cout =  64.8 ff  Cmax =   0.0 ff  G =    0  
ABC: Path  1 --      14 : 2    1 sky130_fd_sc_hd__xnor2_4 A =  27.53  Df = 267.5  -99.1 ps  S = 299.2 ps  Cin = 16.3 ff  Cout =  33.4 ff  Cmax = 211.5 ff  G =  204  
ABC: Start-point = pi0 (\controller_inst.pstate [1]).  End-point = po0 (\result [4]).
ABC: netlist                       : i/o =    3/   10  lat =    0  nd =    12  edge =     15  area =143.88  delay = 2.00  lev = 2
ABC: + write_blif /tmp/yosys-abc-DJaKhV/output.blif 

128.1.2. Re-integrating ABC results.
ABC RESULTS:          _const1_ cells:        2
ABC RESULTS:   sky130_fd_sc_hd__buf_6 cells:        2
ABC RESULTS:   sky130_fd_sc_hd__inv_2 cells:        3
ABC RESULTS:   sky130_fd_sc_hd__nand2b_4 cells:        2
ABC RESULTS:   sky130_fd_sc_hd__xnor2_4 cells:        2
ABC RESULTS:   sky130_fd_sc_hd__xor2_4 cells:        1
ABC RESULTS:        internal signals:        5
ABC RESULTS:           input signals:        3
ABC RESULTS:          output signals:       10
Removing temp directory.

129. Executing SETUNDEF pass (replace undef values with defined constants).

130. Executing HILOMAP pass (mapping to constant drivers).

131. Executing SPLITNETS pass (splitting up multi-bit signals).

132. Executing OPT_CLEAN pass (remove unused cells and wires).
Finding unused cells or wires in module \top..
Removed 2 unused cells and 24 unused wires.
<suppressed ~5 debug messages>

133. Executing INSBUF pass (insert buffer cells for connected wires).
Add top/$auto$insbuf.cc:97:execute$274: \result [4] -> \result [0]
Add top/$auto$insbuf.cc:97:execute$275: \result [5] -> \result [1]

134. Executing CHECK pass (checking for obvious problems).
Checking module top...
Found and reported 0 problems.
{
   "creator": "Yosys 0.53 (git sha1 53c22ab7c, g++ 13.3.0-6ubuntu2~24.04 -fPIC -O3)",
   "invocation": "stat -json -liberty /foss/designs/ALU/runs/RUN_2025-06-08_18-02-53/tmp/3b9a99ebdd5b45e081038bb96c7f5eaf.lib ",
   "modules": {
      "\\top": {
         "num_wires":         12,
         "num_wire_bits":     18,
         "num_pub_wires":     8,
         "num_pub_wire_bits": 14,
         "num_ports":         4,
         "num_port_bits":     10,
         "num_memories":      0,
         "num_memory_bits":   0,
         "num_processes":     0,
         "num_cells":         16,
         "area":              213.955200,
         "num_cells_by_type": {
            "sky130_fd_sc_hd__buf_2": 2,
            "sky130_fd_sc_hd__buf_6": 2,
            "sky130_fd_sc_hd__conb_1": 2,
            "sky130_fd_sc_hd__dfrtp_2": 2,
            "sky130_fd_sc_hd__inv_2": 3,
            "sky130_fd_sc_hd__nand2b_4": 2,
            "sky130_fd_sc_hd__xnor2_4": 2,
            "sky130_fd_sc_hd__xor2_4": 1
         }
      }
   },
      "design": {
         "num_wires":         12,
         "num_wire_bits":     18,
         "num_pub_wires":     8,
         "num_pub_wire_bits": 14,
         "num_ports":         4,
         "num_port_bits":     10,
         "num_memories":      0,
         "num_memory_bits":   0,
         "num_processes":     0,
         "num_cells":         16,
         "area":              213.955200,
         "num_cells_by_type": {
            "sky130_fd_sc_hd__buf_2": 2,
            "sky130_fd_sc_hd__buf_6": 2,
            "sky130_fd_sc_hd__conb_1": 2,
            "sky130_fd_sc_hd__dfrtp_2": 2,
            "sky130_fd_sc_hd__inv_2": 3,
            "sky130_fd_sc_hd__nand2b_4": 2,
            "sky130_fd_sc_hd__xnor2_4": 2,
            "sky130_fd_sc_hd__xor2_4": 1
         }
      }
}

135. Printing statistics.

=== top ===

   Number of wires:                 12
   Number of wire bits:             18
   Number of public wires:           8
   Number of public wire bits:      14
   Number of ports:                  4
   Number of port bits:             10
   Number of memories:               0
   Number of memory bits:            0
   Number of processes:              0
   Number of cells:                 16
     sky130_fd_sc_hd__buf_2          2
     sky130_fd_sc_hd__buf_6          2
     sky130_fd_sc_hd__conb_1         2
     sky130_fd_sc_hd__dfrtp_2        2
     sky130_fd_sc_hd__inv_2          3
     sky130_fd_sc_hd__nand2b_4       2
     sky130_fd_sc_hd__xnor2_4        2
     sky130_fd_sc_hd__xor2_4         1

   Chip area for module '\top': 213.955200
     of which used for sequential elements: 52.550400 (24.56%)

136. Executing Verilog backend.
Dumping module `\top'.

137. Executing JSON backend.
